filename,character,id,description
EK.S2.E9.C59 Ekko throws anomoly at Viktor.mp4,Ekko,EK.S2.E9.C59,Ekko throws anomoly at Viktor
VT.S2.E9.C60 Viktor loses control.mp4,Viktor,VT.S2.E9.C60,Viktor loses control
JC.S2.E9.C61 Jayce shows Viktor vision.mp4,Jayce,JC.S2.E9.C61,Jayce shows Viktor vision
JC.S2.E9.C62 Jayce finds out mage is Viktor.mp4,Jayce,JC.S2.E9.C62,Jayce finds out mage is Viktor
JC.S2.E9.C63 Jayce backstory different timelines.mp4,Jayce,JC.S2.E9.C63,Jayce backstory different timelines
JC.S2.E9.C64 Jayce reconciles with Viktor.mp4,Jayce,JC.S2.E9.C64,Jayce reconciles with Viktor
VT.S2.E9.C65 Viktor undos Glorious Evolution.mp4,Viktor,VT.S2.E9.C65,Viktor undos Glorious Evolution
JC.S2.E9.C66 Jayce and Viktor disappear.mp4,Jayce,JC.S2.E9.C66,Jayce and Viktor disappear
PO.S2.E9.C67 Piltover Glorious Evolution aftermath.mp4,Piltover,PO.S2.E9.C67,Piltover Glorious Evolution aftermath
VI.S2.E9.C68 Vi and Jinx injured after fight.mp4,Vi,VI.S2.E9.C68,Vi and Jinx injured after fight
VI.S2.E9.C69 Vi mourns Warwick.mp4,Vi,VI.S2.E9.C69,Vi mourns Warwick
JX.S2.E9.C70 Jinx saves Vi from Warwick.mp4,Jinx,JX.S2.E9.C70,Jinx saves Vi from Warwick
VI.S2.E9.C71 Vi watches Jinx die.mp4,Vi,VI.S2.E9.C71,Vi watches Jinx die
JX.S2.E9.C72 Jinx blows herself up.mp4,Jinx,JX.S2.E9.C72,Jinx blows herself up
VD.S2.E9.C73 Vander puts Vi Powder to sleep.mp4,Vander,VD.S2.E9.C73,Vander puts Vi Powder to sleep
PO.S2.E9.C74 Piltover war ends; Jayce hammer crumbles.mp4,Piltover,PO.S2.E9.C74,Piltover war ends; Jayce hammer crumbles
PO.S2.E9.C75 Piltover after war.mp4,Piltover,PO.S2.E9.C75,Piltover after war
PO.S2.E9.C76 Piltover mourns losses.mp4,Piltover,PO.S2.E9.C76,Piltover mourns losses
EK.S2.E9.C77 Ekko alone.mp4,Ekko,EK.S2.E9.C77,Ekko alone
SV.S2.E9.C78 Sevika joins Council.mp4,Sevika,SV.S2.E9.C78,Sevika joins Council
XX.S2.E9.C79 Singed and Orianna.mp4,Singed,XX.S2.E9.C79,Singed and Orianna
PO.S2.E9.C80 Raven investigates Hextech.mp4,Piltover,PO.S2.E9.C80,Raven investigates Hextech
ML.S2.E9.C81 Mel returns to Noxus.mp4,Mel,ML.S2.E9.C81,Mel returns to Noxus
CL.S2.E9.C82 Caitlyn investigates Hexgates.mp4,Caitlyn,CL.S2.E9.C82,Caitlyn investigates Hexgates
VI.S2.E9.C83 Vi and Caitlyn settle.mp4,Vi,VI.S2.E9.C83,Vi and Caitlyn settle
PO.S2.E9.C84 Airship leaves Piltover.mp4,Piltover,PO.S2.E9.C84,Airship leaves Piltover
AB.S2.E15.C01 Ambessa injured pregnant wolf.mp4,Ambessa,AB.S2.E15.C01,Ambessa injured pregnant wolf
AB.S2.E15.C02 Ambessa gets visions.mp4,Ambessa,AB.S2.E15.C02,Ambessa gets visions
AB.S2.E15.C03 Ambessa spawn.mp4,Ambessa,AB.S2.E15.C03,Ambessa spawn
AB.S2.E15.C04 Ambessa protects lamb.mp4,Ambessa,AB.S2.E15.C04,Ambessa protects lamb
AB.S2.E15.C05 Ambessa finds statues.mp4,Ambessa,AB.S2.E15.C05,Ambessa finds statues
AB.S2.E15.C06 Ambessa fights warrior.mp4,Ambessa,AB.S2.E15.C06,Ambessa fights warrior
AB.S2.E15.C07 Ambessa's lamb dies.mp4,Ambessa,AB.S2.E15.C07,Ambessa's lamb dies
AB.S2.E15.C08 Ambessa cries.mp4,Ambessa,AB.S2.E15.C08,Ambessa cries
AB.S2.E15.C09 Ambessa becomes a wolf.mp4,Ambessa,AB.S2.E15.C09,Ambessa becomes a wolf
AB.S2.E15.C10 Ambessa sits on throne.mp4,Ambessa,AB.S2.E15.C10,Ambessa sits on throne
AB.S2.E15.C11 Ambessa war god.mp4,Ambessa,AB.S2.E15.C11,Ambessa war god
AB.S2.E15.C12 Ambessa gets back up.mp4,Ambessa,AB.S2.E15.C12,Ambessa gets back up
NX.S3.E0.C01 the Noxian Grand General _ Champion Teaser - League of Legends 1080.mp4,Noxus,NX.S3.E0.C01,the Noxian Grand General _ Champion Teaser - League of Legends 1080
NX.S3.E0.C02 Leblanc draws with magic.mp4,Noxus,NX.S3.E0.C02,Leblanc draws with magic
NX.S3.E0.C03 Kat dances.mp4,Noxus,NX.S3.E0.C03,Kat dances
NX.S3.E0.C04 Kat vs Elise.mp4,Noxus,NX.S3.E0.C04,Kat vs Elise
NX.S3.E0.C05 Mel in Noxus.mp4,Noxus,NX.S3.E0.C05,Mel in Noxus
NX.S3.E0.C06 Darius vs Trundle.mp4,Noxus,NX.S3.E0.C06,Darius vs Trundle
NX.S3.E0.C07 Mel fights illusions.mp4,Noxus,NX.S3.E0.C07,Mel fights illusions
NX.S3.E0.C08 Leblanc and Vlad plot.mp4,Noxus,NX.S3.E0.C08,Leblanc and Vlad plot
