filename,character,id,description
VT.S2.E1.C39 Viktor is alive in hexcore.mp4,Viktor,VT.S2.E1.C39,Viktor is alive in hexcore
XX.S2.E1.C40 Singed attacks wolves.mp4,Singed,XX.S2.E1.C40,Singed attacks wolves
JX.S2.E2.C01 Jinx releases Silco's body.mp4,Jinx,JX.S2.E2.C01,Jinx releases Silco's body
JX.S2.E2.C02 Jinx screams.mp4,Jinx,JX.S2.E2.C02,Jinx screams
ZN.S2.E2.C03 Zaun power vacuum.mp4,Zaun,ZN.S2.E2.C03,Zaun power vacuum
ZN.S2.E2.C04 Zaun infighting.mp4,Zaun,ZN.S2.E2.C04,Zaun infighting
JX.S2.E2.C05 Jinx walks through dangerous Zaun.mp4,Jinx,JX.S2.E2.C05,Jinx walks through dangerous Zaun
IS.S2.E2.C06 Isha introduction.mp4,Isha,IS.S2.E2.C06,Isha introduction
IS.S2.E2.C07 Isha meets Jinx.mp4,Isha,IS.S2.E2.C07,Isha meets Jinx
ZN.S2.E2.C08 Smeech introduced.mp4,Zaun,ZN.S2.E2.C08,Smeech introduced
ZN.S2.E2.C09 Zaun gangs vs the Grey.mp4,Zaun,ZN.S2.E2.C09,Zaun gangs vs the Grey
SV.S2.E2.C10 Sevika deals with Chembarons.mp4,Sevika,SV.S2.E2.C10,Sevika deals with Chembarons
SV.S2.E2.C11 Sevika angry at Silco dying.mp4,Sevika,SV.S2.E2.C11,Sevika angry at Silco dying
SV.S2.E2.C12 Sevika reconciles with Jinx.mp4,Sevika,SV.S2.E2.C12,Sevika reconciles with Jinx
ZN.S2.E2.C13 Jinx is followed.mp4,Zaun,ZN.S2.E2.C13,Jinx is followed
VT.S2.E2.C14 Viktor wakes up; changed.mp4,Viktor,VT.S2.E2.C14,Viktor wakes up; changed
EK.S2.E2.C15 Ekko firelight aftermath.mp4,Ekko,EK.S2.E2.C15,Ekko firelight aftermath
EK.S2.E2.C16 Ekko and Heimerdinger discuss Arcane corruption.mp4,Ekko,EK.S2.E2.C16,Ekko and Heimerdinger discuss Arcane corruption
HM.S2.E2.C17 Heimerdinger and Ekko sneak.mp4,Heimerdinger,HM.S2.E2.C17,Heimerdinger and Ekko sneak
EK.S2.E2.C18 Ekko and Heimerdinger meet Jayce.mp4,Ekko,EK.S2.E2.C18,Ekko and Heimerdinger meet Jayce
VT.S2.E2.C19 Viktor walks through Zaun.mp4,Viktor,VT.S2.E2.C19,Viktor walks through Zaun
JX.S2.E2.C20 Jinx builds new arm.mp4,Jinx,JX.S2.E2.C20,Jinx builds new arm
JX.S2.E2.C21 Jinx escapes Enforcers.mp4,Jinx,JX.S2.E2.C21,Jinx escapes Enforcers
EF.S2.E2.C22 Enforcers hunt Jinx.mp4,Enforcers,EF.S2.E2.C22,Enforcers hunt Jinx
JX.S2.E2.C23 Jinx jumped by Smeech.mp4,Jinx,JX.S2.E2.C23,Jinx jumped by Smeech
JX.S2.E2.C24 Jinx saved by Sevika.mp4,Jinx,JX.S2.E2.C24,Jinx saved by Sevika
SV.S2.E2.C25 Sevika Jinx vs Smeech.mp4,Sevika,SV.S2.E2.C25,Sevika Jinx vs Smeech
IS.S2.E2.C26 Isha saves Jinx.mp4,Isha,IS.S2.E2.C26,Isha saves Jinx
SV.S2.E2.C27 Sevika thanks Jinx.mp4,Sevika,SV.S2.E2.C27,Sevika thanks Jinx
XX.S2.E2.C28 Singed dissects wolves.mp4,Singed,XX.S2.E2.C28,Singed dissects wolves
VT.S2.E2.C29 Viktor cures addicts.mp4,Viktor,VT.S2.E2.C29,Viktor cures addicts
CL.S2.E3.C01 Caitlyn learns about the Grey.mp4,Caitlyn,CL.S2.E3.C01,Caitlyn learns about the Grey
EF.S2.E3.C02 Enforcers suit up.mp4,Enforcers,EF.S2.E3.C02,Enforcers suit up
EF.S2.E3.C03 Enforcers smoke raid Zaun.mp4,Enforcers,EF.S2.E3.C03,Enforcers smoke raid Zaun
EF.S2.E3.C04 Enforcers surprised.mp4,Enforcers,EF.S2.E3.C04,Enforcers surprised
EF.S2.E3.C05 Enforcers interrogate Zaunite.mp4,Enforcers,EF.S2.E3.C05,Enforcers interrogate Zaunite
AB.S2.E3.C06 Ambessa vs black rose.mp4,Ambessa,AB.S2.E3.C06,Ambessa vs black rose
CL.S2.E3.C07 Caitlyn kisses Vi.mp4,Caitlyn,CL.S2.E3.C07,Caitlyn kisses Vi
EF.S2.E3.C08 Enforcers split up.mp4,Enforcers,EF.S2.E3.C08,Enforcers split up
EF.S2.E3.C09 Vi and Cait hunt jinx.mp4,Enforcers,EF.S2.E3.C09,Vi and Cait hunt jinx
AB.S2.E3.C10 Ambessa talks to Salo.mp4,Ambessa,AB.S2.E3.C10,Ambessa talks to Salo
ML.S2.E3.C11 Mel talks to Lest about Ambessa.mp4,Mel,ML.S2.E3.C11,Mel talks to Lest about Ambessa
EF.S2.E3.C12 Vi and Cait in pipes.mp4,Enforcers,EF.S2.E3.C12,Vi and Cait in pipes
JC.S2.E3.C13 Jayce explains wild rune.mp4,Jayce,JC.S2.E3.C13,Jayce explains wild rune
ML.S2.E3.C14 Mel talks to Elora about Ambessa.mp4,Mel,ML.S2.E3.C14,Mel talks to Elora about Ambessa
JC.S2.E3.C15 Jayce Ekko Heim trapped in Arcane.mp4,Jayce,JC.S2.E3.C15,Jayce Ekko Heim trapped in Arcane
EF.S2.E3.C16 Enforcers attack Jinx.mp4,Enforcers,EF.S2.E3.C16,Enforcers attack Jinx
CL.S2.E3.C17 Caitlyn vs Sevika.mp4,Caitlyn,CL.S2.E3.C17,Caitlyn vs Sevika
VI.S2.E3.C18 Vi vs Jinx.mp4,Vi,VI.S2.E3.C18,Vi vs Jinx
EF.S2.E3.C19 Enforcers finish Jinx.mp4,Enforcers,EF.S2.E3.C19,Enforcers finish Jinx
ZN.S2.E3.C20 Zaun smoke attack.mp4,Zaun,ZN.S2.E3.C20,Zaun smoke attack
PO.S2.E3.C21 Piltover gets vandalized.mp4,Piltover,PO.S2.E3.C21,Piltover gets vandalized
CL.S2.E3.C22 Caitlyn breaks up with Vi.mp4,Caitlyn,CL.S2.E3.C22,Caitlyn breaks up with Vi
ML.S2.E3.C23 Mel gets kidnapped by black rose.mp4,Mel,ML.S2.E3.C23,Mel gets kidnapped by black rose
PO.S2.E3.C24 Piltover paint aftermath.mp4,Piltover,PO.S2.E3.C24,Piltover paint aftermath
AB.S2.E3.C25 Ambessa convinces Piltover to war.mp4,Ambessa,AB.S2.E3.C25,Ambessa convinces Piltover to war
AB.S2.E3.C26 Ambessa makes Caitlyn commander.mp4,Ambessa,AB.S2.E3.C26,Ambessa makes Caitlyn commander
AB.S2.E3.C27 Ambessa hires Renni.mp4,Ambessa,AB.S2.E3.C27,Ambessa hires Renni
XX.S2.E3.C28 Singed makes Warwick.mp4,Singed,XX.S2.E3.C28,Singed makes Warwick
LR.S2.E3.C29 Loris leaves enforcers.mp4,Loris,LR.S2.E3.C29,Loris leaves enforcers
MD.S2.E3.C30 Maggie thumps for Caitlyn.mp4,Maddie,MD.S2.E3.C30,Maggie thumps for Caitlyn
PO.S2.E4.C01 Martial law and rebels.mp4,Piltover,PO.S2.E4.C01,Martial law and rebels
IS.S2.E4.C02 Isha admires Jinx.mp4,Isha,IS.S2.E4.C02,Isha admires Jinx
CL.S2.E4.C03 Caitlyn and Maddie.mp4,Caitlyn,CL.S2.E4.C03,Caitlyn and Maddie
IS.S2.E4.C04 Isha bug fight.mp4,Isha,IS.S2.E4.C04,Isha bug fight
IS.S2.E4.C05 Isha and Jinx play.mp4,Isha,IS.S2.E4.C05,Isha and Jinx play
IS.S2.E4.C06 Isha wants to dye hair.mp4,Isha,IS.S2.E4.C06,Isha wants to dye hair
JX.S2.E4.C07 Jinx dyes Isha's hair.mp4,Jinx,JX.S2.E4.C07,Jinx dyes Isha's hair
IS.S2.E4.C08 Isha plays with grenade.mp4,Isha,IS.S2.E4.C08,Isha plays with grenade
IS.S2.E4.C09 Isha wants gun.mp4,Isha,IS.S2.E4.C09,Isha wants gun
AB.S2.E4.C10 Ambessa wants scientists.mp4,Ambessa,AB.S2.E4.C10,Ambessa wants scientists
IS.S2.E4.C11 Isha attacks prison.mp4,Isha,IS.S2.E4.C11,Isha attacks prison
ZN.S2.E4.C12 Zaun prison.mp4,Zaun,ZN.S2.E4.C12,Zaun prison
CL.S2.E4.C13 Caitlyn and Ambessa.mp4,Caitlyn,CL.S2.E4.C13,Caitlyn and Ambessa
PO.S2.E4.C14 Salo learns about Viktor.mp4,Piltover,PO.S2.E4.C14,Salo learns about Viktor
SV.S2.E4.C15 Sevika asks Jinx to rally.mp4,Sevika,SV.S2.E4.C15,Sevika asks Jinx to rally
JX.S2.E4.C16 Jinx talks to dead Silco.mp4,Jinx,JX.S2.E4.C16,Jinx talks to dead Silco
CL.S2.E4.C17 Caitlyn visits mom statue.mp4,Caitlyn,CL.S2.E4.C17,Caitlyn visits mom statue
PO.S2.E4.C18 Riktus interrogates.mp4,Piltover,PO.S2.E4.C18,Riktus interrogates
FL.S2.E4.C19 Firelights mourn Ekko.mp4,Firelights,FL.S2.E4.C19,Firelights mourn Ekko
SV.S2.E4.C20 Sevika visits Vander.mp4,Sevika,SV.S2.E4.C20,Sevika visits Vander
ZN.S2.E4.C21 Zaun rally.mp4,Zaun,ZN.S2.E4.C21,Zaun rally
IS.S2.E4.C22 Isha rallies Zaun.mp4,Isha,IS.S2.E4.C22,Isha rallies Zaun
EF.S2.E4.C23 Piltover arrests Zaun rally.mp4,Enforcers,EF.S2.E4.C23,Piltover arrests Zaun rally
IS.S2.E4.C24 Isha vs Riktus.mp4,Isha,IS.S2.E4.C24,Isha vs Riktus
XX.S2.E4.C25 Singed awakens Warwick.mp4,Singed,XX.S2.E4.C25,Singed awakens Warwick
JX.S2.E4.C26 Jinx looks for Isha.mp4,Jinx,JX.S2.E4.C26,Jinx looks for Isha
JX.S2.E4.C27 Jinx breakdown; learns Isha arrested.mp4,Jinx,JX.S2.E4.C27,Jinx breakdown; learns Isha arrested
ZN.S2.E4.C28 Zaunites shipped to prison.mp4,Zaun,ZN.S2.E4.C28,Zaunites shipped to prison
WW.S2.E4.C29 Warwick pursues trail.mp4,Warwick,WW.S2.E4.C29,Warwick pursues trail
JX.S2.E4.C30 Jinx attacks enforcer.mp4,Jinx,JX.S2.E4.C30,Jinx attacks enforcer
JX.S2.E4.C31 Jinx flips enforcer off.mp4,Jinx,JX.S2.E4.C31,Jinx flips enforcer off
JX.S2.E4.C32 Jinx arrests Sevika.mp4,Jinx,JX.S2.E4.C32,Jinx arrests Sevika
JX.S2.E4.C33 Jinx breaks into prison.mp4,Jinx,JX.S2.E4.C33,Jinx breaks into prison
JX.S2.E4.C34 Jinx breaks into prison.mp4,Jinx,JX.S2.E4.C34,Jinx breaks into prison
EF.S2.E4.C35 Enforcers in prison.mp4,Enforcers,EF.S2.E4.C35,Enforcers in prison
JX.S2.E4.C36 Jinx frees prisoners.mp4,Jinx,JX.S2.E4.C36,Jinx frees prisoners
AB.S2.E4.C37 Ambessa vs Warwick.mp4,Ambessa,AB.S2.E4.C37,Ambessa vs Warwick
JX.S2.E4.C38 Jinx saves Zaunites.mp4,Jinx,JX.S2.E4.C38,Jinx saves Zaunites
JX.S2.E4.C39 Jinx saves Isha in prison.mp4,Jinx,JX.S2.E4.C39,Jinx saves Isha in prison
IS.S2.E4.C40 Isha wants to help Jinx; Sevika takes her away.mp4,Isha,IS.S2.E4.C40,Isha wants to help Jinx; Sevika takes her away
JX.S2.E4.C41 Jinx vs Warwick.mp4,Jinx,JX.S2.E4.C41,Jinx vs Warwick
JX.S2.E4.C42 Jinx fights Warwick in prison.mp4,Jinx,JX.S2.E4.C42,Jinx fights Warwick in prison
JX.S2.E4.C43 Jinx loses against Warwick.mp4,Jinx,JX.S2.E4.C43,Jinx loses against Warwick
WW.S2.E4.C44 Warwick comes to senses with Jinx.mp4,Warwick,WW.S2.E4.C44,Warwick comes to senses with Jinx
VI.S2.E5.C01 Emo Vi introduction.mp4,Vi,VI.S2.E5.C01,Emo Vi introduction
VI.S2.E5.C02 Emo Vi muscles badass.mp4,Vi,VI.S2.E5.C02,Emo Vi muscles badass
VI.S2.E5.C03 Vi drinks at club bar.mp4,Vi,VI.S2.E5.C03,Vi drinks at club bar
VI.S2.E5.C04 Vi winning in fight club.mp4,Vi,VI.S2.E5.C04,Vi winning in fight club
VI.S2.E5.C05 Vi applies grease.mp4,Vi,VI.S2.E5.C05,Vi applies grease
VI.S2.E5.C06 Vi bleeding punches mirror.mp4,Vi,VI.S2.E5.C06,Vi bleeding punches mirror
VI.S2.E5.C07 Vi drowns herself.mp4,Vi,VI.S2.E5.C07,Vi drowns herself
VI.S2.E5.C08 Vi's small apartment.mp4,Vi,VI.S2.E5.C08,Vi's small apartment
VI.S2.E5.C09 Vi gets walked home; pushes away friend; trudges home alone.mp4,Vi,VI.S2.E5.C09,Vi gets walked home; pushes away friend; trudges home alone
VI.S2.E5.C10 Vi sees war banner; Caitlyn.mp4,Vi,VI.S2.E5.C10,Vi sees war banner; Caitlyn
VI.S2.E5.C11 Vi loses and knocked out in fight club.mp4,Vi,VI.S2.E5.C11,Vi loses and knocked out in fight club
VI.S2.E5.C12 Vi dancing in club; sees Caitlyn; punches weirdo.mp4,Vi,VI.S2.E5.C12,Vi dancing in club; sees Caitlyn; punches weirdo
VI.S2.E5.C13 Vi drinks alone; watched by Jinx.mp4,Vi,VI.S2.E5.C13,Vi drinks alone; watched by Jinx
ZN.S2.E5.C14 Zaun fight ring.mp4,Zaun,ZN.S2.E5.C14,Zaun fight ring
ZN.S2.E5.C15 Vi wins; Crowd surprised.mp4,Zaun,ZN.S2.E5.C15,Vi wins; Crowd surprised
ZN.S2.E5.C16 Everyone cheers for Vi fighting.mp4,Zaun,ZN.S2.E5.C16,Everyone cheers for Vi fighting
JX.S2.E5.C17 Jinx bets on Vi.mp4,Jinx,JX.S2.E5.C17,Jinx bets on Vi
JX.S2.E5.C18 Jinx watches emo vi.mp4,Jinx,JX.S2.E5.C18,Jinx watches emo vi
VI.S2.E5.C19 Vi reuinites with Jinx.mp4,Vi,VI.S2.E5.C19,Vi reuinites with Jinx
PO.S2.E5.C20 Stillwater aftermath.mp4,Piltover,PO.S2.E5.C20,Stillwater aftermath
CL.S2.E5.C21 Caitlyn meets Singed.mp4,Caitlyn,CL.S2.E5.C21,Caitlyn meets Singed
XX.S2.E5.C22 Singed interrogation.mp4,Singed,XX.S2.E5.C22,Singed interrogation
ML.S2.E5.C23 Mel wakes up in dungeon.mp4,Mel,ML.S2.E5.C23,Mel wakes up in dungeon
ML.S2.E5.C24 Mel watches Elora die.mp4,Mel,ML.S2.E5.C24,Mel watches Elora die
ML.S2.E5.C25 Mel meets man in dungeon.mp4,Mel,ML.S2.E5.C25,Mel meets man in dungeon
ML.S2.E5.C26 Mel meets Kino.mp4,Mel,ML.S2.E5.C26,Mel meets Kino
VI.S2.E5.C27 Vi joins Jinx and Isha.mp4,Vi,VI.S2.E5.C27,Vi joins Jinx and Isha
JX.S2.E5.C28 Jinx Vi Isha look for Warwick.mp4,Jinx,JX.S2.E5.C28,Jinx Vi Isha look for Warwick
VI.S2.E5.C29 Vi Jinx squabble.mp4,Vi,VI.S2.E5.C29,Vi Jinx squabble
JX.S2.E5.C30 Jinx reconciles with Vi.mp4,Jinx,JX.S2.E5.C30,Jinx reconciles with Vi
AB.S2.E5.C31 Ambessa makes deal with Singed.mp4,Ambessa,AB.S2.E5.C31,Ambessa makes deal with Singed
WW.S2.E5.C32 Warwick memories.mp4,Warwick,WW.S2.E5.C32,Warwick memories
ML.S2.E5.C33 Mel solves puzzle with Kino.mp4,Mel,ML.S2.E5.C33,Mel solves puzzle with Kino
XX.S2.E5.C34 Singed cooks meth.mp4,Singed,XX.S2.E5.C34,Singed cooks meth
CL.S2.E5.C35 Caitlyn investigates Singed.mp4,Caitlyn,CL.S2.E5.C35,Caitlyn investigates Singed
XX.S2.E5.C36 Singed and his daughter.mp4,Singed,XX.S2.E5.C36,Singed and his daughter
ML.S2.E5.C37 Mel realizes she's captured.mp4,Mel,ML.S2.E5.C37,Mel realizes she's captured
ML.S2.E5.C38 Mel uses magic.mp4,Mel,ML.S2.E5.C38,Mel uses magic
WW.S2.E5.C39 Warwick hunts Jinx Vi Isha.mp4,Warwick,WW.S2.E5.C39,Warwick hunts Jinx Vi Isha
VI.S2.E5.C40 Vi and Jinx learn about fathers past.mp4,Vi,VI.S2.E5.C40,Vi and Jinx learn about fathers past
VI.S2.E5.C41 Vi vs Warwick.mp4,Vi,VI.S2.E5.C41,Vi vs Warwick
VD.S2.E5.C42 Vander Silco Vi mom backstory.mp4,Vander,VD.S2.E5.C42,Vander Silco Vi mom backstory
JX.S2.E5.C43 Jinx Vi Warwick Isha hug.mp4,Jinx,JX.S2.E5.C43,Jinx Vi Warwick Isha hug
JC.S2.E5.C44 Jayce released from arcane; kills Salo.mp4,Jayce,JC.S2.E5.C44,Jayce released from arcane; kills Salo
VT.S2.E6.C01 Viktor looks inside Jayce.mp4,Viktor,VT.S2.E6.C01,Viktor looks inside Jayce
PO.S2.E6.C02 Noxus fleet.mp4,Piltover,PO.S2.E6.C02,Noxus fleet
CL.S2.E6.C03 Caitlyn trains with Ambessa.mp4,Caitlyn,CL.S2.E6.C03,Caitlyn trains with Ambessa
JX.S2.E6.C04 Jinx gang go see Viktor.mp4,Jinx,JX.S2.E6.C04,Jinx gang go see Viktor
ZN.S2.E6.C05 Zaun Commune.mp4,Zaun,ZN.S2.E6.C05,Zaun Commune
VT.S2.E6.C06 Viktor tries to heal Warwick.mp4,Viktor,VT.S2.E6.C06,Viktor tries to heal Warwick
VT.S2.E6.C07 Viktor talks to Vi Jinx.mp4,Viktor,VT.S2.E6.C07,Viktor talks to Vi Jinx
VT.S2.E6.C08 Viktor healing Warwick.mp4,Viktor,VT.S2.E6.C08,Viktor healing Warwick
VT.S2.E6.C09 Viktor explores Vander mind.mp4,Viktor,VT.S2.E6.C09,Viktor explores Vander mind
VD.S2.E6.C10 Vander and Vi mom.mp4,Vander,VD.S2.E6.C10,Vander and Vi mom
VI.S2.E6.C11 Vi wants Jinx to stay at commune.mp4,Vi,VI.S2.E6.C11,Vi wants Jinx to stay at commune
ZN.S2.E6.C12 Noxus arrives at commune.mp4,Zaun,ZN.S2.E6.C12,Noxus arrives at commune
XX.S2.E6.C13 Singed remeets with Viktor.mp4,Singed,XX.S2.E6.C13,Singed remeets with Viktor
VI.S2.E6.C14 Vi remeets Caitlyn.mp4,Vi,VI.S2.E6.C14,Vi remeets Caitlyn
ZN.S2.E6.C15 Noxian prepares to invade Commune.mp4,Zaun,ZN.S2.E6.C15,Noxian prepares to invade Commune
JX.S2.E6.C16 Jinx cherishes Isha.mp4,Jinx,JX.S2.E6.C16,Jinx cherishes Isha
VI.S2.E6.C17 Vi plays Ambessa.mp4,Vi,VI.S2.E6.C17,Vi plays Ambessa
VI.S2.E6.C18 Vi vs Ambessa.mp4,Vi,VI.S2.E6.C18,Vi vs Ambessa
JC.S2.E6.C19 Jayce attacks Commune.mp4,Jayce,JC.S2.E6.C19,Jayce attacks Commune
CL.S2.E6.C20 Caitlyn betrays Singed.mp4,Caitlyn,CL.S2.E6.C20,Caitlyn betrays Singed
JC.S2.E6.C21 Jayce tweaks out.mp4,Jayce,JC.S2.E6.C21,Jayce tweaks out
JC.S2.E6.C22 Jayce kills Viktor.mp4,Jayce,JC.S2.E6.C22,Jayce kills Viktor
CL.S2.E6.C23 Caitlyn Jinx Warwick vs Riktus.mp4,Caitlyn,CL.S2.E6.C23,Caitlyn Jinx Warwick vs Riktus
JX.S2.E6.C24 Jinx Vi Warwick family reunion.mp4,Jinx,JX.S2.E6.C24,Jinx Vi Warwick family reunion
ZN.S2.E6.C25 Commune implodes.mp4,Zaun,ZN.S2.E6.C25,Commune implodes
JC.S2.E6.C26 Jayce leaves after ending Commune.mp4,Jayce,JC.S2.E6.C26,Jayce leaves after ending Commune
VT.S2.E6.C27 Viktor killed by Jayce.mp4,Viktor,VT.S2.E6.C27,Viktor killed by Jayce
ZN.S2.E6.C28 Commune war.mp4,Zaun,ZN.S2.E6.C28,Commune war
JX.S2.E6.C29 Jinx watches Isha die.mp4,Jinx,JX.S2.E6.C29,Jinx watches Isha die
IS.S2.E6.C30 Isha sacrifices herself.mp4,Isha,IS.S2.E6.C30,Isha sacrifices herself
JX.S2.E6.C31 Jinx and Isha flashback.mp4,Jinx,JX.S2.E6.C31,Jinx and Isha flashback
EK.S2.E7.C01 Ekko alt uni.mp4,Ekko,EK.S2.E7.C01,Ekko alt uni
EK.S2.E7.C02 Ekko transported by anomoly.mp4,Ekko,EK.S2.E7.C02,Ekko transported by anomoly
EK.S2.E7.C03 Ekko confused in AU.mp4,Ekko,EK.S2.E7.C03,Ekko confused in AU
EK.S2.E7.C04 Ekko sees Powder.mp4,Ekko,EK.S2.E7.C04,Ekko sees Powder
EK.S2.E7.C05 Ekko hugs Benzo.mp4,Ekko,EK.S2.E7.C05,Ekko hugs Benzo
EK.S2.E7.C06 Ekko sees last drop.mp4,Ekko,EK.S2.E7.C06,Ekko sees last drop
EK.S2.E7.C07 Ekko talks to Powder.mp4,Ekko,EK.S2.E7.C07,Ekko talks to Powder
AU.S2.E7.C08 AU Mylo Claggor.mp4,AU,AU.S2.E7.C08,AU Mylo Claggor
EK.S2.E7.C09 Ekko talks to heimerdinger in AU.mp4,Ekko,EK.S2.E7.C09,Ekko talks to heimerdinger in AU
JC.S2.E7.C10 Jayce sees destroyed Piltover.mp4,Jayce,JC.S2.E7.C10,Jayce sees destroyed Piltover
EK.S2.E7.C11 Ekko and Powder see dead Vi.mp4,Ekko,EK.S2.E7.C11,Ekko and Powder see dead Vi
EK.S2.E7.C12 Ekko sees AU Piltover.mp4,Ekko,EK.S2.E7.C12,Ekko sees AU Piltover
EK.S2.E7.C13 Ekko retrives hexcrystals.mp4,Ekko,EK.S2.E7.C13,Ekko retrives hexcrystals
JC.S2.E7.C14 Jayce wanders through wasteland.mp4,Jayce,JC.S2.E7.C14,Jayce wanders through wasteland
AU.S2.E7.C15 AU Vi dies.mp4,AU,AU.S2.E7.C15,AU Vi dies
EK.S2.E7.C16 Ekko in AU Piltover.mp4,Ekko,EK.S2.E7.C16,Ekko in AU Piltover
JC.S2.E7.C17 Jayce tweaks and falls.mp4,Jayce,JC.S2.E7.C17,Jayce tweaks and falls
EK.S2.E7.C18 Ekko talks to Heim about hextech.mp4,Ekko,EK.S2.E7.C18,Ekko talks to Heim about hextech
JC.S2.E7.C19 Jayce survives.mp4,Jayce,JC.S2.E7.C19,Jayce survives
JC.S2.E7.C20 Jayce climbs out.mp4,Jayce,JC.S2.E7.C20,Jayce climbs out
EK.S2.E7.C21 Ekko reconciles with Powder.mp4,Ekko,EK.S2.E7.C21,Ekko reconciles with Powder
JC.S2.E7.C22 Jayce wasteland survivor.mp4,Jayce,JC.S2.E7.C22,Jayce wasteland survivor
EK.S2.E7.C23 Ekko Powder Heim reinvent anomoly.mp4,Ekko,EK.S2.E7.C23,Ekko Powder Heim reinvent anomoly
EK.S2.E7.C24 Ekko discovers time travel.mp4,Ekko,EK.S2.E7.C24,Ekko discovers time travel
JC.S2.E7.C25 Jayce climbs corrupted hexgate.mp4,Jayce,JC.S2.E7.C25,Jayce climbs corrupted hexgate
EK.S2.E7.C26 Ekko says goodbyes to AU.mp4,Ekko,EK.S2.E7.C26,Ekko says goodbyes to AU
EK.S2.E7.C27 Ekko Powder dance.mp4,Ekko,EK.S2.E7.C27,Ekko Powder dance
EK.S2.E7.C28 Ekko Powder kiss.mp4,Ekko,EK.S2.E7.C28,Ekko Powder kiss
JC.S2.E7.C29 Jayce climbs to top.mp4,Jayce,JC.S2.E7.C29,Jayce climbs to top
AU.S2.E7.C30 Powder notices glitches.mp4,AU,AU.S2.E7.C30,Powder notices glitches
EK.S2.E7.C31 Ekko Heim go back.mp4,Ekko,EK.S2.E7.C31,Ekko Heim go back
JC.S2.E7.C32 Jayce meets mage; gets sent back.mp4,Jayce,JC.S2.E7.C32,Jayce meets mage; gets sent back
EK.S2.E7.C33 Ekko Heim portal goes wrong.mp4,Ekko,EK.S2.E7.C33,Ekko Heim portal goes wrong
JC.S2.E7.C34 Jayce teleported.mp4,Jayce,JC.S2.E7.C34,Jayce teleported
HM.S2.E7.C35 Heimerdinger dies.mp4,Heimerdinger,HM.S2.E7.C35,Heimerdinger dies
EK.S2.E7.C36 Ekko teleports back.mp4,Ekko,EK.S2.E7.C36,Ekko teleports back
AU.S2.E7.C37 Powder visits Vi alone.mp4,AU,AU.S2.E7.C37,Powder visits Vi alone
ML.S2.E8.C01 Mel awakens magic.mp4,Mel,ML.S2.E8.C01,Mel awakens magic
ML.S2.E8.C02 Mel talks to illusionist.mp4,Mel,ML.S2.E8.C02,Mel talks to illusionist
ML.S2.E8.C03 Mel learns about Ambessa.mp4,Mel,ML.S2.E8.C03,Mel learns about Ambessa
ML.S2.E8.C04 Mel joins Black Rose; lone mage.mp4,Mel,ML.S2.E8.C04,Mel joins Black Rose; lone mage
AB.S2.E8.C05 Ambessa mourns Riktus.mp4,Ambessa,AB.S2.E8.C05,Ambessa mourns Riktus
XX.S2.E8.C06 Singed revives Viktor.mp4,Singed,XX.S2.E8.C06,Singed revives Viktor
VT.S2.E8.C07 Viktor allies with Ambessa.mp4,Viktor,VT.S2.E8.C07,Viktor allies with Ambessa
VI.S2.E8.C08 Vi nightmare; wakes up.mp4,Vi,VI.S2.E8.C08,Vi nightmare; wakes up
CL.S2.E8.C09 Caitlyn plans with Maddie.mp4,Caitlyn,CL.S2.E8.C09,Caitlyn plans with Maddie
CL.S2.E8.C10 Caitlyn tells Vi Jinx arrested.mp4,Caitlyn,CL.S2.E8.C10,Caitlyn tells Vi Jinx arrested
CL.S2.E8.C11 Caitlyn visits Jinx.mp4,Caitlyn,CL.S2.E8.C11,Caitlyn visits Jinx
ML.S2.E8.C12 Mel returns to Piltover.mp4,Mel,ML.S2.E8.C12,Mel returns to Piltover
JC.S2.E8.C13 Jayce meets Mel mage.mp4,Jayce,JC.S2.E8.C13,Jayce meets Mel mage
ML.S2.E8.C14 Mel and Jayce argue.mp4,Mel,ML.S2.E8.C14,Mel and Jayce argue
JC.S2.E8.C15 Jayce talks to Viktor robot.mp4,Jayce,JC.S2.E8.C15,Jayce talks to Viktor robot
ML.S2.E8.C16 Mel and Jayce vs Viktor.mp4,Mel,ML.S2.E8.C16,Mel and Jayce vs Viktor
JX.S2.E8.C17 Jinx sees Silco in cell.mp4,Jinx,JX.S2.E8.C17,Jinx sees Silco in cell
VI.S2.E8.C18 Vi frees Jinx and betrayed.mp4,Vi,VI.S2.E8.C18,Vi frees Jinx and betrayed
ML.S2.E8.C19 Mel tells Jayce about magic.mp4,Mel,ML.S2.E8.C19,Mel tells Jayce about magic
JC.S2.E8.C20 Jayce unites Piltover for war.mp4,Jayce,JC.S2.E8.C20,Jayce unites Piltover for war
PO.S2.E8.C21 Piltover civilians flee.mp4,Piltover,PO.S2.E8.C21,Piltover civilians flee
ZN.S2.E8.C22 Zaun joins war effort.mp4,Zaun,ZN.S2.E8.C22,Zaun joins war effort
JC.S2.E8.C23 Jayce prepares at Hexgate.mp4,Jayce,JC.S2.E8.C23,Jayce prepares at Hexgate
CL.S2.E8.C24 Caitvi sex.mp4,Caitlyn,CL.S2.E8.C24,Caitvi sex
ML.S2.E8.C25 Mel pleads to Ambessa for peace.mp4,Mel,ML.S2.E8.C25,Mel pleads to Ambessa for peace
AB.S2.E8.C26 Ambessa shows Mel glorious evolution.mp4,Ambessa,AB.S2.E8.C26,Ambessa shows Mel glorious evolution
XX.S2.E8.C27 Singed prepares to revive Viktor.mp4,Singed,XX.S2.E8.C27,Singed prepares to revive Viktor
VT.S2.E8.C28 Viktor sacrifices Skye.mp4,Viktor,VT.S2.E8.C28,Viktor sacrifices Skye
WW.S2.E8.C29 Warwick dies.mp4,Warwick,WW.S2.E8.C29,Warwick dies
VT.S2.E8.C30 Viktor takes chemicals.mp4,Viktor,VT.S2.E8.C30,Viktor takes chemicals
VT.S2.E8.C31 Viktor resurrects.mp4,Viktor,VT.S2.E8.C31,Viktor resurrects
ZN.S2.E8.C32 Commune evolves.mp4,Zaun,ZN.S2.E8.C32,Commune evolves
WW.S2.E8.C33 Warwick revives.mp4,Warwick,WW.S2.E8.C33,Warwick revives
AB.S2.E8.C34 Ambessa tricks Piltover.mp4,Ambessa,AB.S2.E8.C34,Ambessa tricks Piltover
JX.S2.E9.C01 Jinx depressed.mp4,Jinx,JX.S2.E9.C01,Jinx depressed
JX.S2.E9.C02 Jinx cuts hair.mp4,Jinx,JX.S2.E9.C02,Jinx cuts hair
JX.S2.E9.C03 Jinx burns everything.mp4,Jinx,JX.S2.E9.C03,Jinx burns everything
ZN.S2.E9.C04 Zaun burns.mp4,Zaun,ZN.S2.E9.C04,Zaun burns
JX.S2.E9.C05 Jinx blows up.mp4,Jinx,JX.S2.E9.C05,Jinx blows up
EK.S2.E9.C06 Ekko talks to Jinx.mp4,Ekko,EK.S2.E9.C06,Ekko talks to Jinx
PO.S2.E9.C07 Piltover prepares for war.mp4,Piltover,PO.S2.E9.C07,Piltover prepares for war
PO.S2.E9.C08 Piltover defense team plans.mp4,Piltover,PO.S2.E9.C08,Piltover defense team plans
VI.S2.E9.C09 Vi saves enforcer Jinxer.mp4,Vi,VI.S2.E9.C09,Vi saves enforcer Jinxer
NS.S2.E9.C10 Noxus attacks Piltover.mp4,Noxians,NS.S2.E9.C10,Noxus attacks Piltover
ML.S2.E9.C11 Mel commands army.mp4,Mel,ML.S2.E9.C11,Mel commands army
LR.S2.E9.C12 Loris uses Hextech ballista.mp4,Loris,LR.S2.E9.C12,Loris uses Hextech ballista
AB.S2.E9.C13 Ambessa charges into Piltover.mp4,Ambessa,AB.S2.E9.C13,Ambessa charges into Piltover
CL.S2.E9.C14 Caitlyn shoots Ambessa.mp4,Caitlyn,CL.S2.E9.C14,Caitlyn shoots Ambessa
AB.S2.E9.C15 Ambessa signals second wave.mp4,Ambessa,AB.S2.E9.C15,Ambessa signals second wave
NS.S2.E9.C16 Noxians deploy Viktor.mp4,Noxians,NS.S2.E9.C16,Noxians deploy Viktor
VI.S2.E9.C17 Vi fights shimmer Noxians.mp4,Vi,VI.S2.E9.C17,Vi fights shimmer Noxians
CL.S2.E9.C18 Caitlyn joins war.mp4,Caitlyn,CL.S2.E9.C18,Caitlyn joins war
LR.S2.E9.C19 Loris dies.mp4,Loris,LR.S2.E9.C19,Loris dies
EF.S2.E9.C20 Enforcers use grey in war.mp4,Enforcers,EF.S2.E9.C20,Enforcers use grey in war
CL.S2.E9.C21 Caitlyn fights Noxians.mp4,Caitlyn,CL.S2.E9.C21,Caitlyn fights Noxians
EF.S2.E9.C22 Enforcer Steb plants bomb.mp4,Enforcers,EF.S2.E9.C22,Enforcer Steb plants bomb
CL.S2.E9.C23 Caitlyn defeated.mp4,Caitlyn,CL.S2.E9.C23,Caitlyn defeated
EF.S2.E9.C24 Enforcers lose war.mp4,Enforcers,EF.S2.E9.C24,Enforcers lose war
MD.S2.E9.C25 Maddie betrays Caitlyn for Ambessa.mp4,Maddie,MD.S2.E9.C25,Maddie betrays Caitlyn for Ambessa
CL.S2.E9.C26 Caitlyn struggles; Maddie shoots her and dies.mp4,Caitlyn,CL.S2.E9.C26,Caitlyn struggles; Maddie shoots her and dies
ML.S2.E9.C27 Mel enters war against Ambessa.mp4,Mel,ML.S2.E9.C27,Mel enters war against Ambessa
PO.S2.E9.C28 Piltover war pauses; Jinx arrives.mp4,Piltover,PO.S2.E9.C28,Piltover war pauses; Jinx arrives
JX.S2.E9.C29 Jinx joins war.mp4,Jinx,JX.S2.E9.C29,Jinx joins war
EK.S2.E9.C30 Ekko and Firelights join war.mp4,Ekko,EK.S2.E9.C30,Ekko and Firelights join war
ZN.S2.E9.C31 Zaun joins war.mp4,Zaun,ZN.S2.E9.C31,Zaun joins war
EF.S2.E9.C32 Enforcers rejoin war.mp4,Enforcers,EF.S2.E9.C32,Enforcers rejoin war
VI.S2.E9.C33 Vi saved by Jinx.mp4,Vi,VI.S2.E9.C33,Vi saved by Jinx
EF.S2.E9.C34 Enforcer uses Hextech Ballista.mp4,Enforcers,EF.S2.E9.C34,Enforcer uses Hextech Ballista
ML.S2.E9.C35 Mel uses magic.mp4,Mel,ML.S2.E9.C35,Mel uses magic
JC.S2.E9.C36 Jayce shuts down Hexcore.mp4,Jayce,JC.S2.E9.C36,Jayce shuts down Hexcore
VT.S2.E9.C37 Viktor glorious evolution introduction.mp4,Viktor,VT.S2.E9.C37,Viktor glorious evolution introduction
PO.S2.E9.C38 Robots take over Piltover.mp4,Piltover,PO.S2.E9.C38,Robots take over Piltover
WW.S2.E9.C39 Warwick evolution; attacks Vi and Jinx.mp4,Warwick,WW.S2.E9.C39,Warwick evolution; attacks Vi and Jinx
ML.S2.E9.C40 Mel and Caitlyn stand against Ambessa.mp4,Mel,ML.S2.E9.C40,Mel and Caitlyn stand against Ambessa
AB.S2.E9.C41 Ambessa fights Caitlyn Mel.mp4,Ambessa,AB.S2.E9.C41,Ambessa fights Caitlyn Mel
VT.S2.E9.C42 Viktor restores Hexgate.mp4,Viktor,VT.S2.E9.C42,Viktor restores Hexgate
CL.S2.E9.C43 Caitlyn loses against Ambessa.mp4,Caitlyn,CL.S2.E9.C43,Caitlyn loses against Ambessa
ML.S2.E9.C44 Mel defeats Ambessa; betrays Black Rose; Ambessa dies.mp4,Mel,ML.S2.E9.C44,Mel defeats Ambessa; betrays Black Rose; Ambessa dies
VI.S2.E9.C45 Vi and Ekko help Jinx fight Warwick; crashes.mp4,Vi,VI.S2.E9.C45,Vi and Ekko help Jinx fight Warwick; crashes
VI.S2.E9.C46 Vi and Jinx team up.mp4,Vi,VI.S2.E9.C46,Vi and Jinx team up
VT.S2.E9.C47 Viktor flies up.mp4,Viktor,VT.S2.E9.C47,Viktor flies up
VI.S2.E9.C48 Vi and Jinx vs Warwick.mp4,Vi,VI.S2.E9.C48,Vi and Jinx vs Warwick
JC.S2.E9.C49 Jayce and Viktor fight in the air.mp4,Jayce,JC.S2.E9.C49,Jayce and Viktor fight in the air
JC.S2.E9.C50 Jayce loses against Viktor.mp4,Jayce,JC.S2.E9.C50,Jayce loses against Viktor
VT.S2.E9.C51 Viktor takes over Piltover.mp4,Viktor,VT.S2.E9.C51,Viktor takes over Piltover
JC.S2.E9.C52 Jayce gets brainwashed.mp4,Jayce,JC.S2.E9.C52,Jayce gets brainwashed
JC.S2.E9.C53 Jayce enters Glorious Evolution.mp4,Jayce,JC.S2.E9.C53,Jayce enters Glorious Evolution
VT.S2.E9.C54 Viktor gains ultimate power.mp4,Viktor,VT.S2.E9.C54,Viktor gains ultimate power
JC.S2.E9.C55 Jayce pleads to Viktor.mp4,Jayce,JC.S2.E9.C55,Jayce pleads to Viktor
EK.S2.E9.C56 Ekko last stand against Viktor.mp4,Ekko,EK.S2.E9.C56,Ekko last stand against Viktor
VT.S2.E9.C57 Viktor takes over Jayce.mp4,Viktor,VT.S2.E9.C57,Viktor takes over Jayce
EK.S2.E9.C58 Ekko rewinds time.mp4,Ekko,EK.S2.E9.C58,Ekko rewinds time
